{
  "format": "openbindings.asyncapi-http-tls-assets@1",
  "description": "Deterministic C20B3 test-only RSA-2048 hierarchy, including DER-derived name-constraint and fixed RFC 5280 policy witnesses. Private key bytes are harness-only capabilities and never normalized.",
  "validationTimeUnixSeconds": "1893456000",
  "certificates": {
    "root-a": {
      "derBase64": "MIIDDTCCAfWgAwIBAgIBATANBgkqhkiG9w0BAQsFADAWMRQwEgYDVQQDDAtDMjBCIFJvb3QgQTAeFw0yMDAxMDEwMDAwMDBaFw00MDAxMDEwMDAwMDBaMBYxFDASBgNVBAMMC0MyMEIgUm9vdCBBMIIBIjANBgkqhkiG9w0BAQEFAAOCAQ8AMIIBCgKCAQEArWx+/v5hsmx+pelwjJFY5mNntyc0mOxHM532N6CoJA2fzR2kU1Qo/+9u1z04z7zpJXMOUX4qjokn4PhUrU/R6UyQWOJ9ymnuUIvMk5qy72SI+ipZ2sZff5l9yAppMkCe0xb4u1SHo7gqmfIvdkSo/eY0YCJ4Ce+kRh6Dbe1wfnOtZlCrFKnZg11vxn9re5nFtnaKE8Ai90f+cdpc6PlyP6IuIzncwNPGsFu2L67G7CpDrJXgpYeewhttSEV9hQA+sz88i4j2CwLy0AmJ0f3d5clMfVSAFd40af9JvUVpMZvVuqf8aCwFPOhq3QZqc4XV4rTiPreVrLtEU7g1IMPlkQIDAQABo2YwZDASBgNVHRMBAf8ECDAGAQH/AgEBMA4GA1UdDwEB/wQEAwIBBjAdBgNVHQ4EFgQUkOIChW68W4Nj2ZpNtYcb4vWQidMwHwYDVR0jBBgwFoAUkOIChW68W4Nj2ZpNtYcb4vWQidMwDQYJKoZIhvcNAQELBQADggEBAJgDS/FgHPuQDcNLYfOyEc24SKfBiYI2YuYIKMFhY8CSZ4S9H4vMN0JVSNRgszwQVQ2lcFI7r6jvCJblx313NpOUdh8shr2q6KGV8OKi+9Hku6WhgE3D7Rb4hoNEXISlHCMcUwApk8PBZbmbb9bKosKuBtgcPmRT+w9I9qZPCjO4p7w/2KenOq2f7xvSyCGDPrXNBcDuVsiFeMJWbt38zJeVWSBslTpFXMBy5FNIy90DMybqcoGyGt7I2nTRnb4Ko1FU4GWW9kuUs4MWiXZc5tP+gS66OZ4X3UW7SdoLXdri1Koecf0b0dXnn9IQo2pH9C9dg2m031pfDXDg/t86pR4="
    },
    "intermediate-a": {
      "derBase64": "MIIDFTCCAf2gAwIBAgIBAjANBgkqhkiG9w0BAQsFADAWMRQwEgYDVQQDDAtDMjBCIFJvb3QgQTAeFw0yNTAxMDEwMDAwMDBaFw0zNTAxMDEwMDAwMDBaMB4xHDAaBgNVBAMME0MyMEIgSW50ZXJtZWRpYXRlIEEwggEiMA0GCSqGSIb3DQEBAQUAA4IBDwAwggEKAoIBAQDAnAtjvfW9o7RxMSW4hpn1gFe/yLxS98aCjDnJYZgWcVZjSJ4rvk/3EHga+AzBN3ZTS3Epfo5ON5NY/L56IyRrn0NOPt3M9hni4m8AoXxG2A3hUZ4lkCwPj2aLyETz5PTyUU2jF3H57XtuC/K3KpgeriYWrrnZqYfpaVTKESm5XNFWp0NohHOY+ALFoIKrPn+vNnz4FHizRJTNP//pbOwezqIKRnPPCvIZSj+veXBV421OyW+uvSjurwDeZ9WSHwwjAIY/QZPtwiwuj86fkiaOlfUQwVRHCWjrCaeZhwqIzBJwWE70aS8U+hZEr9mAFXTR9Fgtw51G/lineKusxvItAgMBAAGjZjBkMBIGA1UdEwEB/wQIMAYBAf8CAQAwDgYDVR0PAQH/BAQDAgEGMB0GA1UdDgQWBBQjC+86vRI0U+KvH1O9LKlyJ6XdszAfBgNVHSMEGDAWgBSQ4gKFbrxbg2PZmk21hxvi9ZCJ0zANBgkqhkiG9w0BAQsFAAOCAQEAb6c7zTp4neHlld/jOwH+BB9UzTXanhpw8icH8cKcMWHWXNxzRQIU8eJbrSmGl0FzNvJQKwa973HLM/C3ichvaz2QKUq5a4spNCfHGAY2dDfBo1/NVx5lXrcfJpckpCeOyLgfagjF2TtQbnvjY+RBQMFgTN6DMYlbwa1iFhBpthG/0pCchVt0N/gQq1WAbpK7gbvjiW4+ODS0bj0kfRSXSIruEzIzbVJDHaWgtv5amsQbqNQ/Ib+swx0PBNv8Voujz0LZopTWukT2yRCtJycbK0DYDFpfxbrDo8x/pAmrmGhQFye3M0tF1kgB+kfyr8+MhrNTODLKJKIXVUwaL8b0LA=="
    },
    "server-good": {
      "derBase64": "MIIDTjCCAjagAwIBAgIBCjANBgkqhkiG9w0BAQsFADAeMRwwGgYDVQQDDBNDMjBCIEludGVybWVkaWF0ZSBBMB4XDTMwMDEwMTAwMDAwMFoXDTMxMDEwMTAwMDAwMFowGzEZMBcGA1UEAwwQQzIwQiBzZXJ2ZXItZ29vZDCCASIwDQYJKoZIhvcNAQEBBQADggEPADCCAQoCggEBANU9E5UCmg++kuxH6CErJ1rZRbLXIJUOLzuCyQaFyPNQGILOJKlhGlLvVtVZPQJJIuTI86OFLbDAqep5GDsbqI8AA1/VllHI+iIhpmD6m+7GbnONwR4JKia/1n9UgKTgUP/YyfCY/MB9ZrwiY/4Thvd1NXJwbNq3DYdecDk7U/rTn9zeOG21LvInl9SZn32lst4e89rSmUJ8Z2RhduMEmd7saQTaE5GLe9Wkme/+adr6QpeYaciJ7nGBB69EFOBSoiqUtlnSEx8KKvSEm7A5AVUPk2Ia9aFiI+FVZRayd2a6aAH2ATcBAyqXncuK7HwS6cot2A67szr0ivAA/4OIUpkCAwEAAaOBmTCBljAMBgNVHRMBAf8EAjAAMA4GA1UdDwEB/wQEAwIFoDAdBgNVHQ4EFgQUlfM/T41gL/5ZUgiGEgM9tZ9rToEwHwYDVR0jBBgwFoAUIwvvOr0SNFPirx9TvSypciel3bMwEwYDVR0lBAwwCgYIKwYBBQUHAwEwIQYDVR0RBBowGIIQYXBpLmV4YW1wbGUudGVzdIcEwAACATANBgkqhkiG9w0BAQsFAAOCAQEAponFUQ3WnZAIglz3CN4bBOLBfXgqcP7GFe/PlINpO9dR2UqsqcVlwBFbwpaB2460oL7oXYHWIyCE+sC6ddWr3GBahuwow8lNSzZLMRJh75SrRmY9V7JE/sHOzFsouybbcOLqkUZ1qJCL8WniBxhAxlqh66ZA9CNPx+KqtoyVwOtCmTQsfg6+QatPCzlfYW4JG0xi/Vy54YI98fAtgiTD6P5UlfZBmlvX+4qTomZNOn8smI1vtebnO6FyIHRgEJZMXGfUmjqyvyGYuvfvyLTMvRz2cCL4J2ylWmF4fhBzGBmNDaw0i6Ur3ldZrQrh2C5DVaz/Xp5ot2wpnZ6WBAbJng=="
    },
    "server-expired": {
      "derBase64": "MIIDUTCCAjmgAwIBAgIBCzANBgkqhkiG9w0BAQsFADAeMRwwGgYDVQQDDBNDMjBCIEludGVybWVkaWF0ZSBBMB4XDTI4MDEwMTAwMDAwMFoXDTI5MTIzMTIzNTk1OVowHjEcMBoGA1UEAwwTQzIwQiBzZXJ2ZXItZXhwaXJlZDCCASIwDQYJKoZIhvcNAQEBBQADggEPADCCAQoCggEBAKgbtPoApaa3PolYwuac6G3Yh3vdtESNM/dUg0hOc69CFYV09NhKOmBT9cldw6tf5FR/EzAvUAK2p20zNzU6+77rgmQ/rcBZBGmhV1w13CfFQBUq7uSjbBwU6a1uilzOdndD4b8z2J2Hz2P0QTyk9lQgetNusSq3ke8vR5+l7amlQrwL+C4GGX7SQmVw7lUvQ8P+bmQtlI/Dj8ZUZc+6Jj3IjRbn6/doUKNvGK5wXzGqXRmLIaX3QsXcOnCGUn0bUJG+ORtQV3Te2eUozISc3BjQGJVS/OU/tro8KJSm7e5ORevjUwVrQRIn6txrfmT+1mNYpb+FHOxyaDiUwevLcQcCAwEAAaOBmTCBljAMBgNVHRMBAf8EAjAAMA4GA1UdDwEB/wQEAwIFoDAdBgNVHQ4EFgQU7RviIoYVXEEkN0swTKj9w/xIoqMwHwYDVR0jBBgwFoAUIwvvOr0SNFPirx9TvSypciel3bMwEwYDVR0lBAwwCgYIKwYBBQUHAwEwIQYDVR0RBBowGIIQYXBpLmV4YW1wbGUudGVzdIcEwAACATANBgkqhkiG9w0BAQsFAAOCAQEAobcaCesU8u2DkAWfvFgme87qMsW2GsQGaRuALWjRyW0MeAiNDRsbY33retlOtIrL76aLhrrrxejNaWQSAn4QXHVp0sTLJvs53pKk1+3neiykVf5eUzj8OOOv2zvh9pauTyrOkE6N1GVH5e/ZxOKYxRkr2kANClYcEbyD6CR81A9b9wEL1YeOQd/DMS9VV82M9t7zrMKvktIYWFWQJCZKorP0mybrEYh1FhAhOdhUJOSbd649Q9niOLzAcc4KJOUfbVmx8xwdDA70K3RWRuQQGJeCK+fv6u1SFi+O8yJJ09ZSoNKBcoeJDpgiDoZtJigS7Flb68yneX7Cmgb5cE3nVw=="
    },
    "server-future": {
      "derBase64": "MIIDUDCCAjigAwIBAgIBDDANBgkqhkiG9w0BAQsFADAeMRwwGgYDVQQDDBNDMjBCIEludGVybWVkaWF0ZSBBMB4XDTMwMDEwMTAwMDAwMVoXDTMxMDEwMTAwMDAwMFowHTEbMBkGA1UEAwwSQzIwQiBzZXJ2ZXItZnV0dXJlMIIBIjANBgkqhkiG9w0BAQEFAAOCAQ8AMIIBCgKCAQEAxEWwWiS8pges5w0Yg2EYRVSRJuptJM+a4JcDHVe6JEcJfeCyyDGINRL76FfiY3Bmz3daXqER602IrOLx0arvpg9zRIm+9yjvzKlPrBs+OV0NVcUQl1GXUH4ozPbEsheFz+uaT69aPwN+imaNrb8kNL7aMl5lX7bJ74KMyuzw5aQrA4jjifI3SdzDB9/w4K4k4kNhbuMZKBHOk+Nd4dPAHfK1OSIWzCYXyXD9L43ZpKVj1MLgP4UNS54PKyNLsaXux5ClZ2kOaoojbJ2sTD0Hgefc3cpbOwdjV/g1TTvBySFtWMBj6UROwC7iHq4ogb4ig/MaDfIIpoKWtTu/7qJmbQIDAQABo4GZMIGWMAwGA1UdEwEB/wQCMAAwDgYDVR0PAQH/BAQDAgWgMB0GA1UdDgQWBBSsz+CDyAndQ/q/iQU2wj1/XNYM7DAfBgNVHSMEGDAWgBQjC+86vRI0U+KvH1O9LKlyJ6XdszATBgNVHSUEDDAKBggrBgEFBQcDATAhBgNVHREEGjAYghBhcGkuZXhhbXBsZS50ZXN0hwTAAAIBMA0GCSqGSIb3DQEBCwUAA4IBAQBoSmkDtTWgXtmpAAqk+g1KXyCxP6iSnAxzJsq71QGfMVcxpOmfPMmipHPBCM37HTTEFheWpj5pMlKtNYI8E2F5HKU7ZkPvuO4tctB+4a3M1meMgkguDChUGIxCybqqBdl+Cv0NoBTGp03kIZpzgzQeWpswLcQROAED6F6ErSyFgk4RgFkYQhHMb9vQHx9KW5n1ZTxBn3YGalB6VPSUhyxr/GMROY3B6OOFCNn/QIO6YZmEwJwTEDyOQmgtcH9+4wtoxkAqFsYZ2PIiZ9sDI4oUvT+5ZJSu+vZjupdB1Hr1v/bWiTEAB9bw+pWTRDtmzhjQEP6IeHi5973u1KNjAXou"
    },
    "server-client-eku": {
      "derBase64": "MIIDVDCCAjygAwIBAgIBDTANBgkqhkiG9w0BAQsFADAeMRwwGgYDVQQDDBNDMjBCIEludGVybWVkaWF0ZSBBMB4XDTMwMDEwMTAwMDAwMFoXDTMxMDEwMTAwMDAwMFowITEfMB0GA1UEAwwWQzIwQiBzZXJ2ZXItY2xpZW50LWVrdTCCASIwDQYJKoZIhvcNAQEBBQADggEPADCCAQoCggEBAMb9iljOi5RM6KHIvmRYMd0fD2V1V+2F2/ba39wKxsazg36iLTP+fn7r7ahcNdN4LyesRI5Oo3bRkw5fO3XYjNWNw3MC8GCvcMvR+Y8jisCBUDBg6RRD8RSk7cbhabmEZiN1Dj3vl7hgoiqBN0mm2TVcFZWYDuymW4xSGwOHSpLZ9QwJI/5p6WTAagXXAaKuznWlpXgQHkpjMd6icmXVHAIG7AKdSQwApPoZwtd/B5tuhayI8J6ez4rpYkfoo8oCxuLWAg0R0+xL32f19qnjxcS44wMYwY0z27UG9GoLBfk/TnmO/GThQ8MtJe35nUrl+B7w9zxneq18P4eDLTxLhUUCAwEAAaOBmTCBljAMBgNVHRMBAf8EAjAAMA4GA1UdDwEB/wQEAwIFoDAdBgNVHQ4EFgQUlMe8Irh3rXX5ZKrGTpBSxYUVyRcwHwYDVR0jBBgwFoAUIwvvOr0SNFPirx9TvSypciel3bMwEwYDVR0lBAwwCgYIKwYBBQUHAwIwIQYDVR0RBBowGIIQYXBpLmV4YW1wbGUudGVzdIcEwAACATANBgkqhkiG9w0BAQsFAAOCAQEAgMsn/JNWtebfkGttcPA4UkY0I8l6wGAidJ9b/Yj5imglwlCPStg1HXYS10zl4Ic0TmSbeCYomu+iXys5P7Dzkbu2xJzkN4kMY10qvs/yGE1c/YpwNb5hztDcUXzSIbKKILO4JstLPirZBJkOsAysJY1cqS0FypZbpVCiDr2naSNpAcF4Dn/xb7VY1StVOqZf3emNsANJAGw0k4UGkMqUSm8//YysuwyHmL8O9R5j5ZBU1iWIJLlmzqHtBST8yk9le/hukto3cNeXUBMP1F0bN6AORsx5RNJulB9dyzhcI/TfAZcSK12YA8E+95eBsF5TfyIMAR0fH8S0L4+yLhOG0g=="
    },
    "server-bad-ku": {
      "derBase64": "MIIDUDCCAjigAwIBAgIBDjANBgkqhkiG9w0BAQsFADAeMRwwGgYDVQQDDBNDMjBCIEludGVybWVkaWF0ZSBBMB4XDTMwMDEwMTAwMDAwMFoXDTMxMDEwMTAwMDAwMFowHTEbMBkGA1UEAwwSQzIwQiBzZXJ2ZXItYmFkLWt1MIIBIjANBgkqhkiG9w0BAQEFAAOCAQ8AMIIBCgKCAQEA2Oo88NWP2R1icBWw6wNd5MRmWSZ3k2oapDCAEoopl5cadzqSqxniHJoo3t4nfu87pKMl6U5TNm5hyNbPNp/LRhraEjF7fdj7ReHVihm+T0wuVEzfzHQancz9pYexbx27yCfyWwk4OLWzRvc/Ltcp2PEdcBgXNH1jpzpKdtIjV+Vr1Scw2zeQb0LQ/+2gcVGEozIDQIPYd/B7guufLxz0HjG10sbFuvJ9SuCU+mvHMl3VMIxZhdJ8xz+Ce5ZJ4vdPN8vIE4OhXekE7eLOLSEJU2IJhPAqgiBB7dS81133FF4zx1a6xaAx3uqQLW/hWJrIUkiw5OYkOngPdqHPUFx7sQIDAQABo4GZMIGWMAwGA1UdEwEB/wQCMAAwDgYDVR0PAQH/BAQDAgIEMB0GA1UdDgQWBBSP0b64L0bMAlaUawQZROFs+QKmrjAfBgNVHSMEGDAWgBQjC+86vRI0U+KvH1O9LKlyJ6XdszATBgNVHSUEDDAKBggrBgEFBQcDATAhBgNVHREEGjAYghBhcGkuZXhhbXBsZS50ZXN0hwTAAAIBMA0GCSqGSIb3DQEBCwUAA4IBAQB/iEKG+wPl2FclOaftfW3PVWOx/eT0aV5pKuKjdZVm+8NIhdjgihUgbWUKgAlytwSpFH2HlA6J6SmQQVCZYn/hFe/vxUvWL1qvSszyd6uJHvxpy0MG5eduZ4ar6qVX68Wa4SL4oI7i/vt8toIThbgNIsreAYtC649dVEgD7VO8n3bt/l92uzhyQ1eQ63jI6PU3kZ5ntuIgxBQ32jLI0m+EepevlZ1+Fa8inNBMCZztF2wGUoen9KDzQC2YH+PLzR7BlgI1D0YPPQa80FLtUk5Smu3/IRJy+LdK6WPI0vJoB03q+D+KM56+vI709laQRlTrRjKnFAzL8sA3blCXb0J0"
    },
    "root-b": {
      "derBase64": "MIIDDTCCAfWgAwIBAgIBFDANBgkqhkiG9w0BAQsFADAWMRQwEgYDVQQDDAtDMjBCIFJvb3QgQjAeFw0yMDAxMDEwMDAwMDBaFw00MDAxMDEwMDAwMDBaMBYxFDASBgNVBAMMC0MyMEIgUm9vdCBCMIIBIjANBgkqhkiG9w0BAQEFAAOCAQ8AMIIBCgKCAQEA4PhaQEqj83LlZI7dXxTTdbGpCjf2acVec/wTSN0gi78aC9yCsAnCF8IchG6M4VLTTrY1csU8+sjOp1RBGYiEhM50wa4+iC911B2qskkeoX0IjiwFFxoF82YQOQuioIey9aGUi+/RATg8H54Y3mxSxu5B5f0PG7mdvIintkvd08IP4+Y+ruM5qn9Qr85MuEIuHkd7kMXlMM5jbi7z3aRb5zhjxHCipIk0NzaUSD6nxAFTlWBEIJDBo+giUq+3sk90nKTaP2BCTbcdV5ak2VeWYcC5piV5qRjq0p7ngRw5ceDA/cgQhPQgnRjLwkFCpqwmK1lusza7erT5J4rOLfhZ3wIDAQABo2YwZDASBgNVHRMBAf8ECDAGAQH/AgEBMA4GA1UdDwEB/wQEAwIBBjAdBgNVHQ4EFgQU7ESSvTOXY32kJJkeot1O5OjPuJ8wHwYDVR0jBBgwFoAU7ESSvTOXY32kJJkeot1O5OjPuJ8wDQYJKoZIhvcNAQELBQADggEBAHltOMOw3UP2NmV83atg6JVWVzk9CJKkO+52C5E3utlQLfTcmK/CL9Rt9eKxbWs0lPbq/Oftz5tgyQEXUgZ0qVL3gMkDgQiCElVhO6OdGEzpihwp2QCq4e2llfNBFU7M3YCV0Why7DKJq7V08gIU0F26I8NFHMf8KM1W5oXv0Gf7eB0PNdpiifODSirOT34nSMisi7P9MlGhtSD1JhYDRipXP07mgiB64fAElrKwXS0uhz9zKkwxRFZEwHWaZwHXgkNWd1/VJM9d3roOfRtZNS/+StRpSev07gKXiVkOYJrjvCs6wC62oLP8Xky6RgMvVnGWDe93W1IPVYECc18O5ec="
    },
    "server-root-b": {